{"bits": [["c", [0]], ["c", [1]], ["c", [2]], ["c", [3]], ["c", [4]], ["c", [5]], ["c", [6]], ["c", [7]], ["c", [8]]], "commands": [{"args": [["q", [0]]], "op": {"params": ["0.5"], "type": "Rx"}}, {"args": [["q", [1]]], "op": {"params": ["0.5"], "type": "Rx"}}, {"args": [["q", [2]]], "op": {"params": ["0.5"], "type": "Rz"}}, {"args": [["q", [3]]], "op": {"params": ["0.5"], "type": "Rz"}}, {"args": [["q", [4]]], "op": {"params": ["0.5"], "type": "Rz"}}, {"args": [["q", [5]]], "op": {"params": ["0.5"], "type": "Rz"}}, {"args": [["q", [6]]], "op": {"params": ["0.5"], "type": "Rx"}}, {"args": [["q", [7]]], "op": {"params": ["0.5"], "type": "Rz"}}, {"args": [["q", [8]]], "op": {"params": ["0.5"], "type": "Rx"}}, {"args": [["q", [0]]], "op": {"params": ["0.5"], "type": "Rz"}}, {"args": [["q", [1]]], "op": {"params": ["0.5"], "type": "Rz"}}, {"args": [["q", [2]]], "op": {"params": ["0.5"], "type": "Rx"}}, {"args": [["q", [3]]], "op": {"params": ["0.5"], "type": "Rx"}}, {"args": [["q", [4]]], "op": {"params": ["0.5"], "type": "Rx"}}, {"args": [["q", [5]]], "op": {"params": ["0.5"], "type": "Rx"}}, {"args": [["q", [6]]], "op": {"params": ["0.5"], "type": "Rz"}}, {"args": [["q", [7]]], "op": {"params": ["0.5"], "type": "Rx"}}, {"args": [["q", [8]]], "op": {"params": ["0.5"], "type": "Rz"}}, {"args": [["q", [0]]], "op": {"params": ["0.5"], "type": "Rx"}}, {"args": [["q", [1]]], "op": {"params": ["0.5"], "type": "Rx"}}, {"args": [["q", [2]]], "op": {"params": ["0.5"], "type": "Rz"}}, {"args": [["q", [3]]], "op": {"params": ["0.5"], "type": "Rz"}}, {"args": [["q", [4]]], "op": {"params": ["0.5"], "type": "Rz"}}, {"args": [["q", [5]]], "op": {"params": ["0.5"], "type": "Rz"}}, {"args": [["q", [6]]], "op": {"params": ["0.5"], "type": "Rx"}}, {"args": [["q", [7]]], "op": {"params": ["0.5"], "type": "Rz"}}, {"args": [["q", [8]]], "op": {"params": ["0.5"], "type": "Rx"}}, {"args": [["q", [0]]], "op": {"params": ["0.5"], "type": "Rz"}}, {"args": [["q", [1]]], "op": {"params": ["0.5"], "type": "Rz"}}, {"args": [["q", [5]]], "op": {"params": ["0.5"], "type": "Rz"}}, {"args": [["q", [6]]], "op": {"params": ["0.5"], "type": "Rz"}}, {"args": [["q", [8]]], "op": {"params": ["0.5"], "type": "Rz"}}, {"args": [["q", [2]], ["q", [0]]], "op": {"type": "CZ"}}, {"args": [["q", [5]]], "op": {"params": ["0.5"], "type": "Rx"}}, {"args": [["q", [0]]], "op": {"params": ["0.5"], "type": "Rz"}}, {"args": [["q", [5]]], "op": {"params": ["0.5"], "type": "Rz"}}, {"args": [["q", [0]]], "op": {"params": ["0.5"], "type": "Rx"}}, {"args": [["q", [0]]], "op": {"params": ["0.5"], "type": "Rz"}}, {"args": [["q", [0]], ["q", [6]]], "op": {"type": "CZ"}}, {"args": [["q", [6]]], "op": {"params": ["0.5"], "type": "Rz"}}, {"args": [["q", [6]]], "op": {"params": ["0.5"], "type": "Rx"}}, {"args": [["q", [6]]], "op": {"params": ["0.5"], "type": "Rz"}}, {"args": [["q", [6]], ["q", [5]]], "op": {"type": "CZ"}}, {"args": [["q", [5]]], "op": {"params": ["0.5"], "type": "Rz"}}, {"args": [["q", [5]]], "op": {"params": ["0.5"], "type": "Rx"}}, {"args": [["q", [5]]], "op": {"params": ["0.5"], "type": "Rz"}}, {"args": [["q", [5]], ["q", [8]]], "op": {"type": "CZ"}}, {"args": [["q", [8]]], "op": {"params": ["0.5"], "type": "Rz"}}, {"args": [["q", [8]]], "op": {"params": ["0.5"], "type": "Rx"}}, {"args": [["q", [8]]], "op": {"params": ["0.5"], "type": "Rz"}}, {"args": [["q", [8]], ["q", [4]]], "op": {"type": "CZ"}}, {"args": [["q", [4]]], "op": {"params": ["0.5"], "type": "Rz"}}, {"args": [["q", [4]]], "op": {"params": ["0.5"], "type": "Rx"}}, {"args": [["q", [4]]], "op": {"params": ["0.5"], "type": "Rz"}}, {"args": [["q", [4]], ["q", [1]]], "op": {"type": "CZ"}}, {"args": [["q", [1]]], "op": {"params": ["0.5"], "type": "Rz"}}, {"args": [["q", [1]]], "op": {"params": ["0.5"], "type": "Rx"}}, {"args": [["q", [1]]], "op": {"params": ["0.5"], "type": "Rz"}}, {"args": [["q", [1]]], "op": {"params": ["0.904014444694526"], "type": "Rz"}}, {"args": [["q", [1]]], "op": {"params": ["0.5"], "type": "Rz"}}, {"args": [["q", [1]]], "op": {"params": ["0.5"], "type": "Rx"}}, {"args": [["q", [1]]], "op": {"params": ["0.5"], "type": "Rz"}}, {"args": [["q", [4]], ["q", [1]]], "op": {"type": "CZ"}}, {"args": [["q", [1]]], "op": {"params": ["0.5"], "type": "Rz"}}, {"args": [["q", [4]]], "op": {"params": ["0.5"], "type": "Rz"}}, {"args": [["q", [1]]], "op": {"params": ["0.5"], "type": "Rx"}}, {"args": [["q", [4]]], "op": {"params": ["0.5"], "type": "Rx"}}, {"args": [["q", [1]]], "op": {"params": ["0.5"], "type": "Rz"}}, {"args": [["q", [4]]], "op": {"params": ["0.5"], "type": "Rz"}}, {"args": [["q", [1]]], "op": {"params": ["0.5"], "type": "Rx"}}, {"args": [["q", [8]], ["q", [4]]], "op": {"type": "CZ"}}, {"args": [["q", [1]]], "op": {"params": ["0.5"], "type": "Rz"}}, {"args": [["q", [4]]], "op": {"params": ["0.5"], "type": "Rz"}}, {"args": [["q", [8]]], "op": {"params": ["0.5"], "type": "Rz"}}, {"args": [["q", [1]]], "op": {"params": ["0.5"], "type": "Rx"}}, {"args": [["q", [4]]], "op": {"params": ["0.5"], "type": "Rx"}}, {"args": [["q", [8]]], "op": {"params": ["0.5"], "type": "Rx"}}, {"args": [["q", [1]]], "op": {"params": ["0.5"], "type": "Rz"}}, {"args": [["q", [4]]], "op": {"params": ["0.5"], "type": "Rz"}}, {"args": [["q", [8]]], "op": {"params": ["0.5"], "type": "Rz"}}, {"args": [["q", [1]]], "op": {"params": ["0.5"], "type": "Rz"}}, {"args": [["q", [4]]], "op": {"params": ["0.5"], "type": "Rx"}}, {"args": [["q", [5]], ["q", [8]]], "op": {"type": "CZ"}}, {"args": [["q", [1]]], "op": {"params": ["0.5"], "type": "Rx"}}, {"args": [["q", [4]]], "op": {"params": ["0.5"], "type": "Rz"}}, {"args": [["q", [5]]], "op": {"params": ["0.5"], "type": "Rz"}}, {"args": [["q", [8]]], "op": {"params": ["0.5"], "type": "Rz"}}, {"args": [["q", [1]]], "op": {"params": ["0.5"], "type": "Rz"}}, {"args": [["q", [4]]], "op": {"params": ["0.5"], "type": "Rx"}}, {"args": [["q", [5]]], "op": {"params": ["0.5"], "type": "Rx"}}, {"args": [["q", [8]]], "op": {"params": ["0.5"], "type": "Rx"}}, {"args": [["q", [4]]], "op": {"params": ["0.5"], "type": "Rz"}}, {"args": [["q", [5]]], "op": {"params": ["0.5"], "type": "Rz"}}, {"args": [["q", [8]]], "op": {"params": ["0.5"], "type": "Rz"}}, {"args": [["q", [6]], ["q", [5]]], "op": {"type": "CZ"}}, {"args": [["q", [8]]], "op": {"params": ["0.5"], "type": "Rx"}}, {"args": [["q", [5]]], "op": {"params": ["0.5"], "type": "Rz"}}, {"args": [["q", [6]]], "op": {"params": ["0.5"], "type": "Rz"}}, {"args": [["q", [8]]], "op": {"params": ["0.5"], "type": "Rz"}}, {"args": [["q", [5]]], "op": {"params": ["0.5"], "type": "Rx"}}, {"args": [["q", [6]]], "op": {"params": ["0.5"], "type": "Rx"}}, {"args": [["q", [8]]], "op": {"params": ["0.5"], "type": "Rx"}}, {"args": [["q", [5]]], "op": {"params": ["0.5"], "type": "Rz"}}, {"args": [["q", [6]]], "op": {"params": ["0.5"], "type": "Rz"}}, {"args": [["q", [8]]], "op": {"params": ["0.5"], "type": "Rz"}}, {"args": [["q", [0]], ["q", [6]]], "op": {"type": "CZ"}}, {"args": [["q", [5]]], "op": {"params": ["0.5"], "type": "Rz"}}, {"args": [["q", [8]]], "op": {"params": ["0.5"], "type": "Rz"}}, {"args": [["q", [0]]], "op": {"params": ["0.5"], "type": "Rz"}}, {"args": [["q", [5]]], "op": {"params": ["0.5"], "type": "Rx"}}, {"args": [["q", [6]]], "op": {"params": ["0.5"], "type": "Rz"}}, {"args": [["q", [8]]], "op": {"params": ["0.5"], "type": "Rx"}}, {"args": [["q", [0]]], "op": {"params": ["0.5"], "type": "Rx"}}, {"args": [["q", [5]]], "op": {"params": ["0.5"], "type": "Rz"}}, {"args": [["q", [6]]], "op": {"params": ["0.5"], "type": "Rx"}}, {"args": [["q", [8]]], "op": {"params": ["0.5"], "type": "Rz"}}, {"args": [["q", [0]]], "op": {"params": ["0.5"], "type": "Rz"}}, {"args": [["q", [5]]], "op": {"params": ["0.5"], "type": "Rz"}}, {"args": [["q", [6]]], "op": {"params": ["0.5"], "type": "Rz"}}, {"args": [["q", [2]], ["q", [0]]], "op": {"type": "CZ"}}, {"args": [["q", [5]]], "op": {"params": ["0.5"], "type": "Rx"}}, {"args": [["q", [6]]], "op": {"params": ["0.5"], "type": "Rx"}}, {"args": [["q", [0]]], "op": {"params": ["0.5"], "type": "Rz"}}, {"args": [["q", [2]]], "op": {"params": ["0.5"], "type": "Rz"}}, {"args": [["q", [5]]], "op": {"params": ["0.5"], "type": "Rz"}}, {"args": [["q", [6]]], "op": {"params": ["0.5"], "type": "Rz"}}, {"args": [["q", [0]]], "op": {"params": ["0.5"], "type": "Rx"}}, {"args": [["q", [2]]], "op": {"params": ["0.5"], "type": "Rx"}}, {"args": [["q", [5]]], "op": {"params": ["0.5"], "type": "Rz"}}, {"args": [["q", [6]]], "op": {"params": ["0.5"], "type": "Rx"}}, {"args": [["q", [0]]], "op": {"params": ["0.5"], "type": "Rz"}}, {"args": [["q", [2]]], "op": {"params": ["0.5"], "type": "Rz"}}, {"args": [["q", [5]]], "op": {"params": ["0.5"], "type": "Rx"}}, {"args": [["q", [6]]], "op": {"params": ["0.5"], "type": "Rz"}}, {"args": [["q", [0]]], "op": {"params": ["0.5"], "type": "Rx"}}, {"args": [["q", [5]]], "op": {"params": ["0.5"], "type": "Rz"}}, {"args": [["q", [6]]], "op": {"params": ["0.5"], "type": "Rz"}}, {"args": [["q", [0]]], "op": {"params": ["0.5"], "type": "Rz"}}, {"args": [["q", [6]]], "op": {"params": ["0.5"], "type": "Rx"}}, {"args": [["q", [0]]], "op": {"params": ["0.5"], "type": "Rx"}}, {"args": [["q", [6]]], "op": {"params": ["0.5"], "type": "Rz"}}, {"args": [["q", [0]]], "op": {"params": ["0.5"], "type": "Rz"}}, {"args": [["q", [2]], ["q", [6]]], "op": {"type": "CZ"}}, {"args": [["q", [0]], ["q", [8]]], "op": {"type": "CZ"}}, {"args": [["q", [6]]], "op": {"params": ["0.5"], "type": "Rz"}}, {"args": [["q", [6]]], "op": {"params": ["0.5"], "type": "Rx"}}, {"args": [["q", [8]]], "op": {"params": ["0.5"], "type": "Rz"}}, {"args": [["q", [6]]], "op": {"params": ["0.5"], "type": "Rz"}}, {"args": [["q", [8]]], "op": {"params": ["0.5"], "type": "Rx"}}, {"args": [["q", [6]], ["q", [4]]], "op": {"type": "CZ"}}, {"args": [["q", [8]]], "op": {"params": ["0.5"], "type": "Rz"}}, {"args": [["q", [4]]], "op": {"params": ["0.5"], "type": "Rz"}}, {"args": [["q", [8]], ["q", [5]]], "op": {"type": "CZ"}}, {"args": [["q", [4]]]